code,name,category
ROMO,Strategy Shares Newfound/ReSolve Robust Momentum ETF,Multi-Asset
DEEP,Acquirers Small and Micro Deep Value ETF,US Equity - Large Cap Blend
BEG,Leverage Shares 2x Long BE Daily ETF,US Equity - Large Cap Blend
TSMG,Leverage Shares 2X Long TSM Daily ETF,US Equity - Large Cap Blend
PBJN,PGIM S&P 500 Buffer 20 ETF - June,US Equity - Large Cap Blend
ALIL,Argent Focused Small Cap ETF,US Equity - Large Cap Blend
PWS,Pacer WealthShield ETF,Multi-Asset
MEME,Roundhill Meme Stock ETF,US Equity - Large Cap Blend
AAVM,Alpha Architect Global Factor Equity ETF,US Equity - Large Cap Blend
BREE,MFS Blended Research Emerging Markets Equity ETF,US Equity - Large Cap Blend
NISM,NYLI International Small-Mid Cap Equity ETF,US Equity - Large Cap Blend
CVRT,Calamos Convertible Equity Alternative ETF,US Fixed Income
RAYJ,Rayliant SMDAM Japan Equity ETF,US Equity - Large Cap Blend
CPNS,Calamos Nasdaq-100 Structured Alt Protection ETF - September,US Equity - Large Cap Blend
LOHA,Roundhill HALO ETF,US Equity - Large Cap Blend
JPSV,JPMorgan Active Small Cap Value ETF,US Equity - Large Cap Blend
JULM,FT Vest U.S. Equity Max Buffer ETF - July,US Equity - Large Cap Blend
ITDI,iShares LifePath Target Date 2065 ETF,Multi-Asset
PBAU,PGIM S&P 500 Buffer 20 ETF - August,US Equity - Large Cap Blend
TPFG,Timothy Plan Free Cash Flow Growth ETF,US Equity - Large Cap Blend
TAX,Cambria Tax Aware ETF,US Equity - Large Cap Blend
CANQ,Calamos Nasdaq Equity & Income ETF,Multi-Asset
AVGG,Leverage Shares 2X Long AVGO Daily ETF,US Equity - Large Cap Blend
PPTY,US Diversified Real Estate ETF,Real Estate
HEAL,Global X HealthTech ETF,US Equity - Large Cap Blend
VDIG,Vanguard Wellington Dividend Growth Active ETF,US Equity - Large Cap Blend
WDAF,WisdomTree Asia Defense Fund,US Equity - Large Cap Blend
PSCF,Invesco S&P SmallCap Financials ETF,US Equity - Large Cap Blend
APRP,PGIM S&P 500 Buffer 12 ETF - April,US Equity - Large Cap Blend
LCOW,Pacer S&P 500 Quality FCF Aristocrats ETF,US Equity - Large Cap Blend
MVPL,Miller Value Partners Leverage ETF,US Equity - Large Cap Blend
FEBZ,TrueShares Structured Outcome (February) ETF,US Equity - Large Cap Blend
AQWA,Global X Clean Water ETF,US Equity - Large Cap Blend
CAFG,Pacer US Small Cap Cash Cows Growth Leaders ETF,US Equity - Large Cap Blend
XIDE,FT Vest U.S. Equity Buffer & Premium Income ETF - December,US Equity - Large Cap Blend
QBUL,TrueShares Quarterly Bull Hedge ETF,Multi-Asset
GLDW,Roundhill Gold WeeklyPay ETF,Multi-Asset
ILIT,iShares Lithium Miners and Producers ETF,US Equity - Large Cap Blend
SAEF,Schwab Ariel Opportunities ETF,US Equity - Large Cap Blend
KSEP,Innovator U.S. Small Cap Power Buffer ETF - September,US Equity - Large Cap Blend
HELS,Hedgeye 130/30 Equity ETF,US Equity - Large Cap Blend
PSFM,Pacer Swan SOS Flex (April) ETF,US Equity - Large Cap Blend
QTJL,Innovator Growth Accelerated Plus ETF - July,US Equity - Large Cap Blend
MYLD,Cambria Micro and SmallCap Shareholder Yield ETF,US Equity - Large Cap Blend
WULX,Tradr 2X Long WULF Daily ETF,US Equity - Large Cap Blend
AWAY,Amplify Travel Tech ETF,US Equity - Large Cap Blend
BOEU,Direxion Daily BA Bull 2X ETF,US Equity - Large Cap Blend
SHUS,Stratified LargeCap Hedged ETF,US Equity - Large Cap Blend
APRH,Innovator Premium Income 20 Barrier ETF - April,Multi-Asset
HFMF,Unlimited HFMF Managed Futures ETF,Alternative
MAYP,PGIM S&P 500 Buffer 12 ETF - May,US Equity - Large Cap Blend
SSFI,Day Hagan / Ned Davis Research Smart Sector Fixed Income ETF,US Fixed Income
IVSS,Applied Finance IVS US SMID ETF,US Equity - Large Cap Blend
TEMR,T. Rowe Price Emerging Markets Equity Research ETF,US Equity - Large Cap Blend
CBON,VanEck China Bond ETF,US Fixed Income
BRF,VanEck Brazil Small-Cap ETF,US Equity - Large Cap Blend
PQJA,PGIM Nasdaq-100 Buffer 12 ETF - January,US Equity - Large Cap Blend
PRVS,Parnassus Value Select ETF,US Equity - Large Cap Blend
WTIP,WisdomTree Inflation Plus Fund,Multi-Asset
JAPN,Horizon Kinetics Japan Owner Operator ETF,US Equity - Large Cap Blend
UPSX,Tradr 2X Long UPST Daily ETF,US Equity - Large Cap Blend
AMZP,Kurv Yield Prem Strategy Amazon ETF,US Equity - Large Cap Blend
FTKI,First Trust Small Cap BuyWrite Income ETF,US Equity - Large Cap Blend
RCTR,First Trust Bloomberg Nuclear Power ETF,US Equity - Large Cap Blend
MJSC,MUFG Japan Small Cap Active ETF,US Equity - Large Cap Blend
GPT,Intelligent Alpha Atlas ETF,US Equity - Large Cap Blend
VDG,Vanguard Developed Markets ex-US Growth Index ETF,US Equity - Large Cap Blend
USSH,WisdomTree 1-3 Year Laddered Treasury Fund,US Fixed Income
OWNB,Bitwise Bitcoin Standard Corporations ETF,US Equity - Large Cap Blend
SNOY,YieldMax SNOW Option Income Strategy ETF,US Equity - Large Cap Blend
TSLP,Kurv Yield Prem Strategy Tesla ETF,US Equity - Large Cap Blend
BCDF,Horizon Kinetics Blockchain Development ETF,US Equity - Large Cap Blend
VDV,Vanguard Developed Markets ex-US Value Index ETF,US Equity - Large Cap Blend
MCH,Matthews China Active ETF,US Equity - Large Cap Blend
JHAI,Janus Henderson Global Artificial Intelligence ETF,US Equity - Large Cap Blend
MRCP,PGIM S&P 500 Buffer 12 ETF - March,US Equity - Large Cap Blend
TAGS,Teucrium Agricultural Fund,Commodity
CVNY,YieldMax CVNA Option Income Strategy ETF,US Equity - Large Cap Blend
UCIB,ETRACS CMCI Total Return ETN Series B,Commodity
TBJL,Innovator 20+ Year Treasury Bond 9 Buffer ETF - July,US Fixed Income
CPRJ,Calamos Russell 2000 Structured Alt Protection ETF July,US Equity - Large Cap Blend
PEZ,Invesco Dorsey Wright Consumer Cyclicals Momentum ETF,US Equity - Large Cap Blend
TGLB,T. Rowe Price Global Equity ETF,US Equity - Large Cap Blend
WBIF,WBI BullBear Value 3000 ETF,US Equity - Large Cap Blend
XNOV,FT Vest U.S. Equity Enhance & Moderate Buffer ETF - November,US Equity - Large Cap Blend
MUSQ,MUSQ Global Music Industry Index ETF,US Equity - Large Cap Blend
JMID,Janus Henderson Mid Cap Growth Alpha ETF,US Equity - Large Cap Blend
KPDD,KraneShares 2x Long PDD Daily ETF,US Equity - Large Cap Blend
NVDD,Direxion Daily NVDA Bear 1X ETF,US Equity - Large Cap Blend
XTAP,Innovator U.S. Equity Accelerated Plus ETF,US Equity - Large Cap Blend
AAPB,GraniteShares 2x Long AAPL Daily ETF,US Equity - Large Cap Blend
APRB,Aptus April Buffer ETF,US Equity - Large Cap Blend
MEMS,Matthews Emerging Markets Discovery Active ETF,US Equity - Large Cap Blend
FFDI,Fidelity Fundamental Developed International ETF,US Equity - Large Cap Blend
JULP,PGIM S&P 500 Buffer 12 ETF - July,US Equity - Large Cap Blend
ICOI,Bitwise COIN Option Income Strategy ETF,US Equity - Large Cap Blend
MEXX,Direxion Daily MSCI Mexico Bull 3X ETF,US Equity - Large Cap Blend
HELX,Franklin Genomic Advancements ETF,US Equity - Large Cap Blend
MCHS,Matthews China Innovators Active ETF,US Equity - Large Cap Blend
TARK,AXS 2X Innovation ETF Fund,US Equity - Large Cap Blend
FEBP,PGIM S&P 500 Buffer 12 ETF - February,US Equity - Large Cap Blend
QQQP,Tradr 2X Long Innovation 100 Quarterly ETF,US Equity - Large Cap Blend
PLTZ,Defiance Daily Target 2x Short PLTR ETF,US Equity - Large Cap Blend
RISE,Pictet Emerging Markets Rising Economies ETF,US Fixed Income
KONG,Formidable Fortress ETF,US Equity - Large Cap Blend
TESL,Simplify Volt TSLA Revolution ETF,US Equity - Large Cap Blend
TLTP,Amplify TLT U.S. Treasury 12% Option Income ETF,US Fixed Income
HAIL,State Street SPDR S&P Kensho Smart Mobility ETF,US Equity - Large Cap Blend
UXOC,FT Vest U.S. Equity Uncapped Accelerator ETF - October,US Equity - Large Cap Blend
ESLG,Eventide Large Cap Growth ETF,US Equity - Large Cap Blend
ELIL,Direxion Daily LLY Bull 2X ETF,US Equity - Large Cap Blend
HDG,ProShares Hedge Replication ETF,Alternative
PALU,Direxion Daily PANW Bull 2X ETF,US Equity - Large Cap Blend
NMBL,NovaTide Flexible Allocation ETF,Multi-Asset
SEPP,PGIM S&P 500 Buffer 12 ETF - September,US Equity - Large Cap Blend
VEMY,Virtus Stone Harbor Emerging Markets High Yield Bond ETF,US Fixed Income
PSCD,Invesco S&P SmallCap Consumer Discretionary ETF,US Equity - Large Cap Blend
PYPG,Leverage Shares 2X Long PYPL Daily ETF,US Equity - Large Cap Blend
PEMX,Putnam Emerging Markets ex-China ETF,US Equity - Large Cap Blend
CIFU,T-REX 2X Long CIFR Daily Target ETF,US Equity - Large Cap Blend
DTAN,Sparkline International Intangible Value ETF,US Equity - Large Cap Blend
TACN,T. Rowe Price Active Core International Equity ETF,US Equity - Large Cap Blend
XOEF,iShares S&P 500 ex S&P 100 ETF,US Equity - Large Cap Blend
GMEU,T-REX 2X Long GME Daily Target ETF,US Equity - Large Cap Blend
PQAP,PGIM Nasdaq-100 Buffer 12 ETF - April,US Equity - Large Cap Blend
QTOC,Innovator Growth Accelerated Plus ETF - October,US Equity - Large Cap Blend
AUGP,PGIM S&P 500 Buffer 12 ETF - August,US Equity - Large Cap Blend
EMPB,Efficient Market Portfolio Plus ETF Trust Units,Multi-Asset
QTJA,Innovator Growth Accelerated Plus ETF - January,US Equity - Large Cap Blend
PSCM,Invesco S&P SmallCap Materials ETF,US Equity - Large Cap Blend
QSU,Defiance Daily Target 2X Long QS ETF,US Equity - Large Cap Blend
BWTG,Brendan Wood TopGun ETF,US Equity - Large Cap Blend
QETH,Invesco Galaxy Ethereum ETF,Currency
XTJA,Innovator U.S. Equity Accelerated Plus ETF - January,US Equity - Large Cap Blend
TMED,T. Rowe Price Health Care ETF,US Equity - Large Cap Blend
DDTS,Innovator Equity Dual Directional 10 Buffer ETF - September,US Equity - Large Cap Blend
FBUF,Fidelity Dynamic Buffered Equity ETF,US Equity - Large Cap Blend
FTXG,First Trust Nasdaq Food & Beverage ETF,US Equity - Large Cap Blend
UBRL,GraniteShares 2x Long UBER Daily ETF,US Equity - Large Cap Blend
CSCL,Direxion Daily CSCO Bull 2X ETF,US Equity - Large Cap Blend
SCAP,Infrastructure Capital Small Cap Income ETF,US Equity - Large Cap Blend
HFEQ,Unlimited HFEQ Equity Long/Short ETF,Alternative
OCTH,Innovator Premium Income 20 Barrier ETF - October,US Equity - Large Cap Blend
DRKY,VistaShares Target 15 DRUKMacro Distribution ETF,US Equity - Large Cap Blend
SMHB,ETRACS 2xMonthly Pay Leveraged US Small Cap High Dividend ETN Series B,US Equity - Large Cap Blend
FORH,Formidable ETF,Alternative
GDOC,Future Health Care Equity ETF,US Equity - Large Cap Blend
MARB,First Trust Merger Arbitrage ETF,Alternative
NVDS,Tradr 1.5X Short NVDA Daily ETF,US Equity - Large Cap Blend
UPW,ProShares Ultra Utilities,US Equity - Large Cap Blend
TTT,ProShares UltraPro Short 20+ Year Treasury,US Fixed Income
DLNV,FT Vest U.S. Equity Dual Directional Buffer ETF - November,US Equity - Large Cap Blend
TOCT,Innovator Equity Defined Protection ETF - 2 Yr to October 2027,US Equity - Large Cap Blend
FTBI,First Trust Balanced Income ETF,Multi-Asset
SHPU,Direxion Daily SHOP Bull 2X ETF,US Equity - Large Cap Blend
LDRI,iShares iBonds 1-5 Year TIPS Ladder ETF,US Fixed Income
JANH,Innovator Premium Income 20 Barrier ETF - January,US Equity - Large Cap Blend
FDRX,Founder-Led 2X Daily ETF,US Equity - Large Cap Blend
OCTJ,Innovator Premium Income 30 Barrier ETF - October,US Equity - Large Cap Blend
QSIX,Pacer Metaurus Nasdaq 100 Dividend Multiplier 600 ETF,US Equity - Large Cap Blend
FMQQ,FMQQ The Next Frontier Internet ETF,US Equity - Large Cap Blend
QUSA,VistaShares Target 15 USA Quality Income ETF,US Equity - Large Cap Blend
DECO,State Street Galaxy Digital Asset Ecosystem ETF,US Equity - Large Cap Blend
QTAP,Innovator Growth Accelerated Plus ETF - April,US Equity - Large Cap Blend
MIG,VanEck Moody's Analytics IG Corporate Bond ETF,US Fixed Income
COZX,Tradr 2X Long CORZ Daily ETF,US Equity - Large Cap Blend
RDTY,YieldMax R2000 0DTE Covered Strategy ETF,US Equity - Large Cap Blend
CPSP,Calamos S&P 500 Structured Alt Protection ETF - April,US Equity - Large Cap Blend
BAIG,Leverage Shares 2X Long BBAI Daily ETF,US Equity - Large Cap Blend
BCHI,GMO Beyond China ETF,US Equity - Large Cap Blend
NEWZ,StockSnips AI-Powered Sentiment US All Cap ETF,US Equity - Large Cap Blend
SEA,U.S. Global Sea to Sky Cargo ETF,US Equity - Large Cap Blend
SLTY,YieldMax Ultra Short Option Income Strategy ETF,US Equity - Large Cap Blend
PCLO,VIRTUS SEIX AAA Private Credit CLO ETF,US Fixed Income
STRN,SMART Trend 25 ETF,US Equity - Large Cap Blend
MYCK,State Street My2031 Corporate Bond ETF,US Fixed Income
DIVD,Altrius Global Dividend ETF,US Equity - Large Cap Blend
HIBS,Direxion Daily S&P 500 High Beta Bear 3X ETF,US Equity - Large Cap Blend
WANT,Direxion Daily Consumer Discretionary Bull 3X ETF,US Equity - Large Cap Blend
SROI,Calamos Antetokounmpo Global Sustainable Equities ETF,US Equity - Large Cap Blend
GGM,GGM Macro Alignment ETF,US Equity - Large Cap Blend
NBIZ,Tradr 2X Short NBIS Daily ETF,US Equity - Large Cap Blend
RINF,ProShares Inflation Expectations ETF,Alternative
MEDX,Horizon Kinetics Medical ETF,US Equity - Large Cap Blend
VRAI,Virtus Real Asset Income ETF,Real Estate
QNXT,iShares Nasdaq-100 ex Top 30 ETF,US Equity - Large Cap Blend
RSJN,FT Vest U.S. Equity Equal Weight Buffer ETF - June,US Equity - Large Cap Blend
SCLZ,Swan Enhanced Dividend Income ETF,US Equity - Large Cap Blend
SNOU,T-REX 2X Long SNOW Daily Target ETF,US Equity - Large Cap Blend
APXM,FT Vest U.S. Equity Max Buffer ETF - April,US Equity - Large Cap Blend
ZTWO,F/M 2-Year Investment Grade Corporate Bond Etf,US Fixed Income
USAF,Atlas America Fund,Multi-Asset
LBAY,Leatherback Long/Short Alternative Yield ETF,Alternative
NBCE,Neuberger China Equity ETF,US Equity - Large Cap Blend
JUNT,AllianzIM U.S. Equity Buffer10 Jun ETF,US Equity - Large Cap Blend
CDEI,"Calvert US Large-Cap Diversity, Equity and Inclusion Index ETF",US Equity - Large Cap Blend
QQQS,Invesco NASDAQ Future Gen 200 ETF,US Equity - Large Cap Blend
TPOR,Direxion Daily Transportation Bull 3X ETF,US Equity - Large Cap Blend
RW,Rainwater Equity ETF,US Equity - Large Cap Blend
CRMX,Tradr 2X Long CRML Daily ETF,US Equity - Large Cap Blend
BABO,YieldMax BABA Option Income Strategy ETF,US Equity - Large Cap Blend
QIG,WisdomTree U.S. Corporate Bond Fund,US Fixed Income
RTAI,Rareview Tax Advantaged Income ETF,US Fixed Income
VUS,Virtus US Dividend ETF,US Equity - Large Cap Blend
ION,ProShares S&P Global Core Battery Metals ETF,US Equity - Large Cap Blend
IREZ,Tradr 2X Short IREN Daily ETF,US Equity - Large Cap Blend
RCLY,Reckoner BBB-B CLO Annual ETF,US Fixed Income
FIGG,Leverage Shares 2x Long FIG Daily ETF,US Equity - Large Cap Blend
AMA,Defiance Daily Target 2X Long AMAT ETF,US Equity - Large Cap Blend
MOTG,VanEck Morningstar Global Wide Moat ETF,US Equity - Large Cap Blend
PLU,Defiance Daily Target 2x Long PL ETF,US Equity - Large Cap Blend
TNXT,T. Rowe Price Innovation Leaders ETF,US Equity - Large Cap Blend
YSPY,GraniteShares YieldBOOST SPY ETF,US Equity - Large Cap Blend
PJFM,PGIM Jennison Focused Mid-Cap ETF,US Equity - Large Cap Blend
PSCU,Invesco S&P SmallCap Utilities & Communication Services ETF,US Equity - Large Cap Blend
TEXN,iShares Texas Equity ETF,US Equity - Large Cap Blend
ESIM,Eventide International ETF,US Equity - Large Cap Blend
VSTL,Defiance Daily Target 2X Long VST ETF,US Equity - Large Cap Blend
SETH,ProShares Short Ether ETF,Currency
SPUT,Innovator Equity Premium Income - Daily PutWrite ETF,US Equity - Large Cap Blend
MNZL,Manzil Russell Halal USA Broad Market ETF,US Equity - Large Cap Blend
XMAY,FT Vest U.S. Equity Enhance & Moderate Buffer ETF - May,US Equity - Large Cap Blend
HDMV,First Trust Horizon Managed Volatility Developed Intl ETF,US Equity - Large Cap Blend
ABLG,Abacus FCF International Leaders ETF,US Equity - Large Cap Blend
XLUI,State Street Utilities Select Sector SPDR Premium Income ETF,US Equity - Large Cap Blend
JULH,Innovator Premium Income 20 Barrier ETF - July,US Equity - Large Cap Blend
WTRE,WisdomTree New Economy Real Estate Fund,Real Estate
SRS,ProShares UltraShort Real Estate,Real Estate
FPRO,Fidelity Real Estate Investment ETF,US Equity - Large Cap Blend
ACSG,American Century Small Cap Growth Insights ETF,US Equity - Large Cap Blend
KJUN,Innovator U.S. Small Cap Power Buffer ETF - June,US Equity - Large Cap Blend
EZMO,AlphaDroid Broad Markets Momentum ETF,Multi-Asset
GENZ,VanEck Digital Native Economy ETF,US Equity - Large Cap Blend
PQOC,PGIM Nasdaq-100 Buffer 12 ETF - October,US Equity - Large Cap Blend
TSEP,FT Vest Emerging Market Buffer ETF - September,US Equity - Large Cap Blend
ONDG,Leverage Shares 2X Long ONDS Daily ETF,US Equity - Large Cap Blend
UNL,United States 12 Month Natural Gas Fund LP,Commodity
QLVE,FlexShares Emerging Markets Quality Low Volatility Index Fund,US Equity - Large Cap Blend
AVGU,GraniteShares 2x Long AVGO Daily ETF,US Equity - Large Cap Blend
HCOW,Amplify COWS Covered Call ETF,US Equity - Large Cap Blend
RNEM,First Trust Emerging Markets Equity Select ETF,US Equity - Large Cap Blend
CEGX,Tradr 2X Long CEG Daily ETF,US Equity - Large Cap Blend
TBX,ProShares Short 7-10 Year Treasury,US Fixed Income
CRSH,YieldMax Short TSLA Option Income Strategy ETF,US Equity - Large Cap Blend
DLAG,FT Vest U.S. Equity Dual Directional Buffer ETF - August,US Equity - Large Cap Blend
WMTI,REX WMT Growth & Income ETF,US Equity - Large Cap Blend
PRTO,RCN Pareto Strategic Allocation ETF,Multi-Asset
UUUG,Leverage Shares 2X Long UUUU Daily ETF,US Equity - Large Cap Blend
NYSX,Global X NYSE 100 ETF,US Equity - Large Cap Blend
BOUT,CapForce IBD Breakout Opportunities ETF,US Equity - Large Cap Blend
TWOX,iShares Large Cap Accelerated Outcome ETF,US Equity - Large Cap Blend
PCLN,Pictet Cleaner Planet ETF,US Equity - Large Cap Blend
VDI,Virtus International Dividend ETF,US Equity - Large Cap Blend
LCDS,JPMorgan Fundamental Data Science Large Core ETF,US Equity - Large Cap Blend
MSFD,Direxion Daily MSFT Bear 1X ETF,US Equity - Large Cap Blend
IVEP,Dan IVES Wedbush AI Power & Infrastructure ETF,US Equity - Large Cap Blend
CLCV,Crossmark Large Cap Value ETF,US Equity - Large Cap Blend
MRGR,Proshares Merger ETF,Alternative
BRKW,Roundhill BRKB WeeklyPay ETF,US Equity - Large Cap Blend
TSL,GraniteShares 1.25x Long TSLA Daily ETF ,US Equity - Large Cap Blend
KHYB,KraneShares Asia Pacific High Income USD Bond ETF,US Fixed Income
FTAG,First Trust Indxx Global Agriculture ETF,US Equity - Large Cap Blend
JULJ,Innovator Premium Income 30 Barrier ETF - July,US Equity - Large Cap Blend
BITC,Bitwise Trendwise Bitcoin and Treasuries Rotation Strategy ETF,Currency
QRMI,Global X NASDAQ 100 Risk Managed Income ETF,US Equity - Large Cap Blend
JANJ,Innovator Premium Income 30 Barrier ETF - January,US Equity - Large Cap Blend
QRFT,QRAFT AI Enhanced U.S. Large Cap ETF,US Equity - Large Cap Blend
RFCI,ALPS Dynamic Core Income ETF,US Fixed Income
DDXX,Defined Duration 20 ETF,US Equity - Large Cap Blend
ZTOP,F/m High Yield 100 ETF,US Fixed Income
FFLV,Fidelity Fundamental Large Cap Value ETF,US Equity - Large Cap Blend
SHRY,First Trust Bloomberg Shareholder Yield ETF,US Equity - Large Cap Blend
CEW,WisdomTree Emerging Currency Strategy Fund,Currency
BUYO,KraneShares Man Buyout Beta Index ETF,US Equity - Large Cap Blend
SEF,ProShares Short Financials,US Equity - Large Cap Blend
DGIN,VanEck Digital India ETF,US Equity - Large Cap Blend
DULL,MicroSectors Gold -3X Inverse Leveraged ETNs,Commodity
UST,ProShares Ultra 7-10 Year Treasury,US Fixed Income
RAAY,Reckoner Yield Enhanced AAA CLO Annual ETF,US Fixed Income
TLTI,NEOS Enhanced Income 20+ Year Treasury Bond ETF,US Fixed Income
FOWF,Pacer Solactive Whitney Future of Warfare ETF,US Equity - Large Cap Blend
RULE,Collaborative Investment Series Trust - Adaptive Core ETF,Multi-Asset
LOPP,Gabelli Love Our Planet & People ETF,US Equity - Large Cap Blend
JCHI,JPMorgan Active China ETF Active China ETF,US Equity - Large Cap Blend
RCLR,Reckoner BBB-B CLO Reinvesting ETF,US Fixed Income
MPLY,Strategy Shares Monopoly ETF,US Equity - Large Cap Blend
DVGR,DAC 3D Dividend Growth ETF,US Equity - Large Cap Blend
MNRS,Grayscale Bitcoin Miners ETF,US Equity - Large Cap Blend
IMST,Bitwise MSTR Option Income Strategy ETF,US Equity - Large Cap Blend
HIS,Humilis US Focused Opportunities ETF,US Equity - Large Cap Blend
NETG,Leverage Shares 2X Long NET Daily ETF,US Equity - Large Cap Blend
NFLW,Roundhill NFLX WeeklyPay ETF,US Equity - Large Cap Blend
RVNL,GraniteShares 2x Long RIVN Daily ETF,US Equity - Large Cap Blend
STXL,Defiance Daily Target 2x Long STX ETF,US Equity - Large Cap Blend
BTF,CoinShares Bitcoin and Ether ETF,Currency
NERD,Roundhill Video Games ETF,US Equity - Large Cap Blend
OILT,Texas Capital Texas Oil Index ETF,US Equity - Large Cap Blend
FMKT,Free Markets ETF,US Equity - Large Cap Blend
NBGX,Neuberger Growth ETF,US Equity - Large Cap Blend
CPNM,Calamos Nasdaq-100 Structured Alt Protection ETF - March,US Equity - Large Cap Blend
BALQ,iShares Nasdaq Premium Income Active ETF,US Equity - Large Cap Blend
DTRE,First Trust Alerian Disruptive Technology Real Estate ETF,Multi-Asset
SKF,ProShares UltraShort Financials,US Equity - Large Cap Blend
SOUX,Defiance Daily Target 2X Long SOUN ETF,US Equity - Large Cap Blend
CSEX,Tradr 2X Long CLS Daily ETF,US Equity - Large Cap Blend
USGG,Leverage Shares 2X Long USAR Daily ETF,US Equity - Large Cap Blend
BITY,Amplify Bitcoin 2% Monthly Option Income ETF,Currency
PQJL,PGIM Nasdaq-100 Buffer 12 ETF - July,US Equity - Large Cap Blend
SHRT,Gotham Short Strategies ETF,US Equity - Large Cap Blend
EEMO,Invesco S&P Emerging Markets Momentum ETF,US Equity - Large Cap Blend
JLQD,Janus Henderson Corporate Bond ETF,US Fixed Income
EVLU,iShares MSCI Emerging Markets Value Factor ETF,US Equity - Large Cap Blend
FEAC,Fidelity Enhanced U.S. All-Cap Equity ETF,US Equity - Large Cap Blend
EPV,ProShares UltraShort FTSE Europe,US Equity - Large Cap Blend
UPV,ProShares Ultra FTSE Europe,US Equity - Large Cap Blend
TACU,T. Rowe Price Active Core U.S. Equity ETF,US Equity - Large Cap Blend
ONEH,TrueShares Equity Hedge ETF,US Equity - Large Cap Blend
CONI,GraniteShares 2x Short COIN Daily ETF,US Equity - Large Cap Blend
TIME,Clockwise Core Equity & Innovation ETF,US Equity - Large Cap Blend
HOOX,Defiance Daily Target 2X Long HOOD ETF,US Equity - Large Cap Blend
FDTS,First Trust Developed Markets ex-US Small Cap AlphaDEX Fund,US Equity - Large Cap Blend
VNSE,Natixis Vaughan Nelson Select ETF,US Equity - Large Cap Blend
SIOO,VistaShares Target 15 S&P 100 Distribution ETF,US Equity - Large Cap Blend
MAGC,Roundhill China Magnificent Seven ETF,US Equity - Large Cap Blend
ERET,iShares Environmentally Aware Real Estate ETF,US Equity - Large Cap Blend
EOSU,T-REX 2X Long EOSE Daily Target ETF,US Equity - Large Cap Blend
CPSU,Calamos S&P 500 Structured Alt Protection Etf June,US Equity - Large Cap Blend
EZJ,ProShares Ultra MSCI Japan,US Equity - Large Cap Blend
TYLG,Global X Information Technology Covered Call & Growth ETF,US Equity - Large Cap Blend
LOCT,Innovator Premium Income 15 Buffer ETF - October,US Equity - Large Cap Blend
RJVI,RJ Eagle Vertical Income ETF,Multi-Asset
CORD,T-REX 2X Inverse CRWV Daily Target ETF,US Equity - Large Cap Blend
EMIF,iShares Emerging Markets Infrastructure ETF,US Equity - Large Cap Blend
QQQG,Pacer Nasdaq 100 Top 50 Cash Cows Growth Leaders ETF,US Equity - Large Cap Blend
NVDB,ProShares Ultra NVDA,US Equity - Large Cap Blend
XLVI,State Street Health Care Select Sector SPDR Premium Income ETF,US Equity - Large Cap Blend
YQQQ,YieldMax Short N100 Option Income Strategy ETF,US Equity - Large Cap Blend
GLXU,T-REX 2X Long GLXY Daily Target ETF,US Equity - Large Cap Blend
MYMI,State Street My2029 Municipal Bond ETF,US Fixed Income
COSW,Roundhill COST WeeklyPay ETF,US Equity - Large Cap Blend
ACSV,American Century Small Cap Value Insights ETF,US Equity - Large Cap Blend
PILL,Direxion Daily Pharmaceutical & Medical Bull 3X ETF,US Equity - Large Cap Blend
BAGY,Amplify Bitcoin Max Income Covered Call ETF,Currency
XTJL,Innovator U.S. Equity Accelerated Plus ETF - July,US Equity - Large Cap Blend
WTID,MicroSectors Energy 3X Inverse Leveraged ETNs,US Equity - Large Cap Blend
UXJA,FT Vest U.S. Equity Uncapped Accelerator ETF - January,US Equity - Large Cap Blend
TFNS,T. Rowe Price Financials ETF,US Equity - Large Cap Blend
KPHO,Kraneshares Dragon Capital Vietnam Growth Index ETF,US Equity - Large Cap Blend
SMLL,Harbor Active Small Cap ETF,US Equity - Large Cap Blend
GGLS,Direxion Daily GOOGL Bear 1X ETF,US Equity - Large Cap Blend
CAS,Simplify China A Shares PLUS Income ETF,US Equity - Large Cap Blend
DUKQ,Ocean Park Domestic ETF,US Equity - Large Cap Blend
COPA,Themes Copper Miners ETF,US Equity - Large Cap Blend
FLYT,Tradr 2X Long FLY Daily ETF,Multi-Asset
XNDX,Tradr 2X Long XNDU Daily ETF,US Equity - Large Cap Blend
IONZ,Defiance Daily Target 2x Short IONQ ETF,US Equity - Large Cap Blend
CPRA,Calamos Russell 2000 Structured Alt Protection ETF - April,US Equity - Large Cap Blend
PBOT,Pictet AI & Automation ETF,US Equity - Large Cap Blend
QQHG,Invesco QQQ Hedged Advantage ETF,US Equity - Large Cap Blend
SNPG,Xtrackers S&P 500 Growth Scored & Screened ETF,US Equity - Large Cap Blend
MKAM,MKAM ETF,Multi-Asset
RBLU,T-REX 2X Long RBLX Daily Target ETF,US Equity - Large Cap Blend
TENJ,iShares Large Cap 10% Target Buffer Jun ETF,US Equity - Large Cap Blend
AGMI,Themes Silver Miners ETF,US Equity - Large Cap Blend
INDE,Matthews India Active ETF,US Equity - Large Cap Blend
ITDJ,iShares LifePath Target Date 2070 ETF,Multi-Asset
AVXX,Defiance Daily Target 2x Long AVAV ETF,US Equity - Large Cap Blend
QOWZ,Invesco Nasdaq Free Cash Flow Achievers ETF,US Equity - Large Cap Blend
BETH,ProShares Bitcoin & Ether Market Cap Weight ETF,Currency
FEAT,YieldMax Dorsey Wright Featured 5 Income ETF,US Equity - Large Cap Blend
SDCP,Virtus Newfleet Short Duration Core Plus Bond ETF,US Fixed Income
GGTL,Gabelli Global Technology Leaders ETF,US Equity - Large Cap Blend
RAAR,Reckoner Yield Enhanced AAA CLO Reinvesting ETF,US Fixed Income
ARWG,Archer Growth ETF,US Equity - Large Cap Blend
SPDG,State Street SPDR Portfolio S&P Sector Neutral Dividend ETF,US Equity - Large Cap Blend
MVRL,ETRACS Monthly Pay 1.5x Leveraged Mortgage REIT ETN,Real Estate
ARMW,Roundhill ARM WeeklyPay ETF,US Equity - Large Cap Blend
