code,name,category
TLTD,FlexShares Morningstar Developed Markets ex-US Factor Tilt Index Fund,US Equity - Large Cap Blend
CLOZ,Eldridge BBB-B CLO ETF,US Fixed Income
JHSC,John Hancock Multifactor Small Cap ETF,US Equity - Large Cap Blend
CAOS,Alpha Architect Tail Risk ETF,Multi-Asset
MINO,PIMCO Municipal Income Opportunities Active Exchange-Traded Fund,US Fixed Income
LGOV,First Trust Long Duration Opportunities ETF,US Fixed Income
SFY,SoFi Select 500 ETF,US Equity - Large Cap Blend
BRES,Burney U.S. Equity Select ETF,US Equity - Large Cap Blend
SAMT,Strategas Macro Thematic Opportunities ETF,US Equity - Large Cap Blend
NAIL,Direxion Daily Homebuilders & Supplies Bull 3X ETF,US Equity - Large Cap Blend
VSDM,Vanguard Short Duration Tax-Exempt Bond ETF,US Fixed Income
ISCV,iShares Morningstar Small Cap Value ETF,US Equity - Large Cap Blend
WSML,iShares MSCI World Small-Cap ETF,US Equity - Large Cap Blend
EWI,iShares MSCI Italy ETF,US Equity - Large Cap Blend
EBI,Longview Advantage ETF,US Equity - Large Cap Blend
SMDV,ProShares Russell 2000 Dividend Growers ETF,US Equity - Large Cap Blend
DBJP,Xtrackers MSCI Japan Hedged Equity ETF,US Equity - Large Cap Blend
TOPT,iShares Top 20 U.S. Stocks ETF,US Equity - Large Cap Blend
TAXF,American Century Diversified Municipal Bond ETF,US Fixed Income
HNDL,Strategy Shares Nasdaq 7HANDL Index ETF,Multi-Asset
AVNM,Avantis All International Markets Equity ETF,US Equity - Large Cap Blend
SETM,Sprott Critical Materials ETF,US Equity - Large Cap Blend
ISCF,iShares International Small‑Cap Equity Factor ETF,US Equity - Large Cap Blend
XVV,iShares ESG Select Screened S&P 500 ETF,US Equity - Large Cap Blend
IBMP,iShares iBonds Dec 2027 Term Muni Bond ETF,US Fixed Income
AFLG,First Trust Active Factor Large Cap ETF,US Equity - Large Cap Blend
BKMC,BNY Mellon US Mid Cap Core Equity ETF,US Equity - Large Cap Blend
QJUN,FT Vest Nasdaq-100 Buffer ETF - June,US Equity - Large Cap Blend
IBMQ,iShares iBonds Dec 2028 Term Muni Bond ETF,US Fixed Income
GVIP,Goldman Sachs Hedge Industry VIP ETF,US Equity - Large Cap Blend
FFLG,Fidelity Fundamental Large Cap Growth ETF,US Equity - Large Cap Blend
SEIQ,SEI Enhanced U.S. Large Cap Quality Factor ETF,US Equity - Large Cap Blend
RSPH,Invesco S&P 500 Equal Weight Health Care ETF,US Equity - Large Cap Blend
SGDM,Sprott Gold Miners ETF,US Equity - Large Cap Blend
EPOL,iShares MSCI Poland ETF,US Equity - Large Cap Blend
PJUN,Innovator U.S. Equity Power Buffer ETF - June,US Equity - Large Cap Blend
VFMF,Vanguard U.S. Multifactor ETF,US Equity - Large Cap Blend
FYLD,Cambria Foreign Shareholder Yield ETF,US Equity - Large Cap Blend
LSVD,LSV Disciplined Value ETF,US Equity - Large Cap Blend
CNEQ,Alger Concentrated Equity ETF,US Equity - Large Cap Blend
ROUS,Hartford Multifactor US Equity ETF,US Equity - Large Cap Blend
DGT,State Street SPDR Global Dow ETF,US Equity - Large Cap Blend
GXUS,Goldman Sachs MarketBeta Total International Equity ETF,US Equity - Large Cap Blend
SMIN,iShares MSCI India Small-Cap ETF,US Equity - Large Cap Blend
QSPT,FT Vest Nasdaq-100 Buffer ETF - September,US Equity - Large Cap Blend
RSPG,Invesco S&P 500 Equal Weight Energy ETF,US Equity - Large Cap Blend
INTW,GraniteShares 2x Long INTC Daily ETF,US Equity - Large Cap Blend
NPFE,NPF Core Equity ETF,US Equity - Large Cap Blend
AAOX,Tradr 2X Long AAOI Daily ETF,US Equity - Large Cap Blend
ZALT,Innovator U.S. Equity 10 Buffer ETF - Quarterly,US Equity - Large Cap Blend
AVMV,Avantis U.S. Mid Cap Value ETF,US Equity - Large Cap Blend
AIS,VistaShares Artificial Intelligence Supercycle ETF,US Equity - Large Cap Blend
WTAI,WisdomTree Artificial Intelligence and Innovation Fund,US Equity - Large Cap Blend
FLRT,Pacer Aristotle Pacific Floating Rate High Income ETF,US Fixed Income
QINT,American Century Quality Diversified International ETF,US Equity - Large Cap Blend
DFSE,Dimensional Emerging Markets Sustainability Core 1 ETF,US Equity - Large Cap Blend
XES,State Street SPDR S&P Oil & Gas Equipment & Services ETF,US Equity - Large Cap Blend
FSMB,First Trust Short Duration Managed Municipal ETF,US Fixed Income
XSVM,Invesco S&P SmallCap Value with Momentum ETF,US Equity - Large Cap Blend
SDCI,USCF SummerHaven Dynamic Commodity Strategy No K-1 Fund,Commodity
TAFM,AB Tax-Aware Intermediate Municipal ETF,US Fixed Income
IXP,iShares Global Comm Services ETF,US Equity - Large Cap Blend
HCMT,Direxion HCM Tactical Enhanced US ETF,US Equity - Large Cap Blend
FMAT,Fidelity MSCI Materials Index ETF,US Equity - Large Cap Blend
BBHY,JPMorgan BetaBuilders USD High Yield Corporate Bond ETF,US Fixed Income
IAT,iShares U.S. Regional Banks ETF,US Equity - Large Cap Blend
RPAR,RPAR Risk Parity ETF,Multi-Asset
RAA,SMI 3Fourteen REAL Asset Allocation ETF,Multi-Asset
LVHD,Franklin U.S. Low Volatility High Dividend Index ETF,US Equity - Large Cap Blend
XRT,State Street SPDR S&P Retail ETF,US Equity - Large Cap Blend
EMEQ,Nomura ETF Trust Nomura Focused Emerging Markets Equity ETF,US Equity - Large Cap Blend
NVDX,T-Rex 2X Long NVIDIA Daily Target ETF,US Equity - Large Cap Blend
GDE,WisdomTree Efficient Gold Plus Equity Strategy Fund,Multi-Asset
CONL,GraniteShares 2x Long COIN Daily ETF,US Equity - Large Cap Blend
EMHY,iShares J.P. Morgan EM High Yield Bond ETF,US Fixed Income
LGH,HCM Defender 500 Index ETF,Multi-Asset
IBMO,iShares iBonds Dec 2026 Term Muni Bond ETF,US Fixed Income
AQEC,AQE Core ETF,US Equity - Large Cap Blend
ILTB,iShares Core 10+ Year USD Bond ETF,US Fixed Income
FLBR,Franklin FTSE Brazil ETF,US Equity - Large Cap Blend
CLSE,Convergence Long/Short Equity ETF,Alternative
IGLD,FT Vest Gold Strategy Target Income ETF,Commodity
CTEF,Castellan Targeted Equity ETF,US Equity - Large Cap Blend
SSUS,Strategy Shares Day Hagan Smart Sector ETF,US Equity - Large Cap Blend
FLCO,Franklin Investment Grade Corporate ETF,US Fixed Income
PSFF,Pacer Swan SOS Fund of Funds ETF,US Equity - Large Cap Blend
DWLD,Davis Select Worldwide ETF,US Equity - Large Cap Blend
VNM,VanEck Vietnam ETF,US Equity - Large Cap Blend
SMRI,Bushido Capital US Equity ETF,US Equity - Large Cap Blend
SFLO,VictoryShares Small Cap Free Cash Flow ETF,US Equity - Large Cap Blend
JPSE,JPMorgan Diversified Return U.S. Small Cap Equity ETF,US Equity - Large Cap Blend
JUST,Goldman Sachs JUST U.S. Large Cap Equity ETF,US Equity - Large Cap Blend
BKUI,BNY Mellon Ultra Short Income ETF,US Fixed Income
USSG,Xtrackers MSCI USA Selection Equity ETF,US Equity - Large Cap Blend
SVOL,Simplify Volatility Premium ETF,Volatility
IBTL,iShares iBonds Dec 2031 Term Treasury ETF,US Fixed Income
ELM,Elm Market Navigator ETF,Multi-Asset
INDY,iShares India 50 ETF,US Equity - Large Cap Blend
SEEM,SEI Select Emerging Markets Equity ETF,US Equity - Large Cap Blend
HYBL,State Street Blackstone High Income ETF,US Fixed Income
IEO,iShares U.S. Oil & Gas Exploration & Production ETF,US Equity - Large Cap Blend
TOTR,T. Rowe Price Total Return ETF,US Fixed Income
TNGY,Tortoise Energy ETF,Multi-Asset
PSQ,ProShares Short QQQ,US Equity - Large Cap Blend
GQGU,GQG US Equity ETF,US Equity - Large Cap Blend
NXTG,First Trust Indxx NextG ETF,US Equity - Large Cap Blend
FNGS,MicroSectors FANG+ ETN,US Equity - Large Cap Blend
FLCG,Federated Hermes MDT Large Cap Growth ETF,US Equity - Large Cap Blend
QMAR,FT Vest Nasdaq-100 Buffer ETF - March,US Equity - Large Cap Blend
RSPU,Invesco S&P 500 Equal Weight Utilities ETF,US Equity - Large Cap Blend
ULST,State Street Ultra Short Term Bond ETF,US Fixed Income
VXX,iPath Series B S&P 500 VIX Short-Term Futures ETN,Volatility
AGZ,iShares Agency Bond ETF,US Fixed Income
SIXH,ETC 6 Meridian Hedged Equity Index Option ETF,Multi-Asset
CMDY,iShares Bloomberg Roll Select Commodity Strategy ETF,Commodity
FNY,First Trust Mid Cap Growth AlphaDEX Fund,US Equity - Large Cap Blend
REM,iShares Mortgage Real Estate ETF,Real Estate
BRNY,Burney U.S. Factor Rotation ETF,US Equity - Large Cap Blend
SPYU,MAX S&P 500 4X Leveraged ETN,US Equity - Large Cap Blend
QDEF,FlexShares Quality Dividend Defensive Index Fund,US Equity - Large Cap Blend
PLTU,Direxion Daily PLTR Bull 2X ETF,US Equity - Large Cap Blend
MYCH,State Street My2028 Corporate Bond ETF,US Fixed Income
IXG,iShares Global Financials ETF,US Equity - Large Cap Blend
FDEM,Fidelity Emerging Markets Multifactor ETF,US Equity - Large Cap Blend
FIVA,Fidelity International Value Factor ETF,US Equity - Large Cap Blend
PNQI,Invesco NASDAQ Internet ETF,US Equity - Large Cap Blend
YLD,Principal Active High Yield ETF,Multi-Asset
BSCY,Invesco BulletShares 2034 Corporate Bond ETF,US Fixed Income
IDOG,ALPS International Sector Dividend Dogs ETF,US Equity - Large Cap Blend
WIP,State Street SPDR FTSE International Government Inflation-Protected Bond ETF,US Fixed Income
BLUX,Bluemonte Dynamic Total Market ETF,US Equity - Large Cap Blend
EIPX,FT Energy Income Partners Strategy ETF,US Equity - Large Cap Blend
PBOG,Portfolio Building Block Integrated Oil and Gas and Exploration and Production Index ETF,US Equity - Large Cap Blend
PBEU,Portfolio Building Block European Banks Index ETF,US Equity - Large Cap Blend
METU,Direxion Daily META Bull 2X ETF,US Equity - Large Cap Blend
IBTM,iShares iBonds Dec 2032 Term Treasury ETF,US Fixed Income
HEZU,iShares Currency Hedged MSCI Eurozone ETF,US Equity - Large Cap Blend
DAPP,VanEck Digital Transformation ETF,US Equity - Large Cap Blend
PBW,Invesco WilderHill Clean Energy ETF,US Equity - Large Cap Blend
IPKW,Invesco International BuyBack Achievers™ ETF,US Equity - Large Cap Blend
CFA,VictoryShares US 500 Volatility Wtd ETF,US Equity - Large Cap Blend
LONZ,PIMCO Senior Loan Active Exchange-Traded Fund,US Fixed Income
OCTW,AllianzIM U.S. Equity Buffer20 Oct ETF,US Equity - Large Cap Blend
PSCT,Invesco S&P SmallCap Information Technology ETF,US Equity - Large Cap Blend
MSTU,T-Rex 2X Long MSTR Daily Target ETF,US Equity - Large Cap Blend
BBHL,BBH Select Large Cap ETF,US Equity - Large Cap Blend
HYGH,iShares Interest Rate Hedged High Yield Bond ETF,US Fixed Income
BSJT,Invesco BulletShares 2029 High Yield Corporate Bond ETF,US Fixed Income
FDHY,Fidelity Enhanced High Yield ETF,US Fixed Income
QVAL,Alpha Architect U.S. Quantitative Value ETF,US Equity - Large Cap Blend
QFLR,Innovator Nasdaq-100 Managed Floor ETF,US Equity - Large Cap Blend
SEIS,SEI Select Small Cap ETF,US Equity - Large Cap Blend
AAUS,Alpha Architect US Equity ETF,US Equity - Large Cap Blend
FEP,First Trust Europe AlphaDEX Fund,US Equity - Large Cap Blend
VGSR,Vert Global Sustainable Real Estate ETF,US Equity - Large Cap Blend
EPU,iShares MSCI Peru and Global Exposure ETF,US Equity - Large Cap Blend
EWN,iShares MSCI Netherlands ETF,US Equity - Large Cap Blend
LQDH,iShares Interest Rate Hedged Corporate Bond ETF,US Fixed Income
DWX,State Street SPDR S&P International Dividend ETF,US Equity - Large Cap Blend
TSMX,Direxion Daily TSM Bull 2X ETF,US Equity - Large Cap Blend
VSLU,Applied Finance Valuation Large Cap ETF,US Equity - Large Cap Blend
CXSE,WisdomTree China ex-State-Owned Enterprises Fund,US Equity - Large Cap Blend
CSM,Proshares Large Cap Core Plus,US Equity - Large Cap Blend
LABU,Direxion Daily S&P Biotech Bull 3X ETF,US Equity - Large Cap Blend
ABFL,Abacus FCF Leaders ETF,US Equity - Large Cap Blend
VSDB,Vanguard Short Duration Bond ETF,US Fixed Income
DDM,ProShares Ultra Dow30,US Equity - Large Cap Blend
HYEM,VanEck Emerging Markets High Yield Bond ETF,US Fixed Income
WWJD,Inspire International ETF,US Equity - Large Cap Blend
VBND,Vident U.S. Bond Strategy ETF,US Fixed Income
SPSK,SP Funds Dow Jones Global Sukuk ETF,US Fixed Income
FPAG,FPA Global Equity ETF,US Equity - Large Cap Blend
FAD,First Trust Multi Cap Growth AlphaDEX Fund,US Equity - Large Cap Blend
BITU,ProShares Ultra Bitcoin ETF,Currency
STPZ,PIMCO 1-5 Year US TIPS Index Exchange-Traded Fund,US Fixed Income
EFAA,Invesco MSCI EAFE Income Advantage ETF,US Equity - Large Cap Blend
EFAX,State Street SPDR MSCI EAFE Fossil Fuel Reserves Free ETF,US Equity - Large Cap Blend
UMI,USCF Midstream Energy Income Fund ETF,US Equity - Large Cap Blend
DFVX,Dimensional US Large Cap Vector ETF,US Equity - Large Cap Blend
UVIX,2x Long VIX Futures ETF,Volatility
AAEQ,Alpha Architect US Equity 2 ETF,US Equity - Large Cap Blend
FIGB,Fidelity Investment Grade Bond ETF,US Fixed Income
BTCO,Invesco Galaxy Bitcoin ETF,Currency
ACYN,FT Vest Laddered Autocallable Barrier & Income ETF,US Equity - Large Cap Blend
TECB,iShares U.S. Tech Breakthrough Multisector ETF,US Equity - Large Cap Blend
RSSB,Return Stacked Global Stocks & Bonds ETF,Multi-Asset
UNG,United States Natural Gas Fund LP,Commodity
TUSI,Touchstone Ultra Short Income ETF,US Fixed Income
AGGH,Simplify Aggregate Bond ETF,US Fixed Income
MAYW,AllianzIM U.S. Equity Buffer20 May ETF,US Equity - Large Cap Blend
NTSI,WisdomTree International Efficient Core Fund,Multi-Asset
ENFR,Alerian Energy Infrastructure ETF,US Equity - Large Cap Blend
LITX,Tradr 2X Long LITE Daily ETF,US Equity - Large Cap Blend
FXF,Invesco CurrencyShares Swiss Franc Trust,Currency
BBHM,BBH Select Mid Cap ETF,US Equity - Large Cap Blend
OSEA,Harbor International Compounders ETF,US Equity - Large Cap Blend
SIXA,ETC 6 Meridian Mega Cap Equity ETF,US Equity - Large Cap Blend
BINV,Brandes International ETF,US Equity - Large Cap Blend
HAPI,Harbor Human Capital Factor US Large Cap ETF,US Equity - Large Cap Blend
IDUB,Aptus International Enhanced Yield,US Equity - Large Cap Blend
JPRE,JPMorgan Realty Income ETF,US Equity - Large Cap Blend
BASG,Brown Advisory Sustainable Growth ETF,US Equity - Large Cap Blend
INMU,iShares Intermediate Muni Income Active ETF,US Fixed Income
SPXU,ProShares UltraPro Short S&P500,US Equity - Large Cap Blend
CMBS,iShares CMBS ETF,US Fixed Income
TDVI,FT Vest Technology Dividend Target Income ETF,US Equity - Large Cap Blend
TXUE,Thornburg International Equity ETF,US Equity - Large Cap Blend
FISR,State Street Fixed Income Sector Rotation ETF,US Fixed Income
MFSV,MFS Active Value ETF,US Equity - Large Cap Blend
DJAN,FT Vest US Equity Deep Buffer ETF - January,US Equity - Large Cap Blend
SDS,ProShares UltraShort S&P 500,US Equity - Large Cap Blend
GRPM,Invesco S&P MidCap 400 GARP ETF,US Equity - Large Cap Blend
GRNJ,Fundstrat Granny Shots US Small- & Mid-Cap ETF,US Equity - Large Cap Blend
AMZA,InfraCap MLP ETF,US Equity - Large Cap Blend
GXC,State Street SPDR S&P China ETF,US Equity - Large Cap Blend
WTPI,WisdomTree Equity Premium Income Fund,US Equity - Large Cap Blend
GJAN,FT Vest U.S. Equity Moderate Buffer ETF - Jan,US Equity - Large Cap Blend
BGRN,iShares Trust iShares USD Green Bond ETF,US Fixed Income
BITQ,Bitwise Crypto Industry Innovators ETF,US Equity - Large Cap Blend
DNL,WisdomTree Global ex-U.S. Quality Growth Fund,US Equity - Large Cap Blend
IAUI,NEOS Gold High Income ETF,Commodity
UVXY,ProShares Ultra VIX Short-Term Futures ETF,Volatility
DPST,Direxion Daily Regional Banks Bull 3X ETF,US Equity - Large Cap Blend
XBB,BondBloxx BB-Rated USD High Yield Corporate Bond ETF,US Fixed Income
ICLO,Invesco AAA CLO Floating Rate Note ETF,US Fixed Income
FGDL,Franklin Responsibly Sourced Gold ETF,Commodity
IBND,State Street SPDR Bloomberg International Corporate Bond ETF,US Fixed Income
IBD,Inspire Corporate Bond ETF,US Fixed Income
PRAE,PlanRock Alternative Growth ETF,Multi-Asset
STOT,State Street DoubleLine Short Duration Total Return Tactical ETF,US Fixed Income
BOIL,ProShares Ultra Bloomberg Natural Gas,Commodity
DFNL,Davis Select Financial ETF,US Equity - Large Cap Blend
VFQY,Vanguard U.S. Quality Factor ETF,US Equity - Large Cap Blend
EDGF,3EDGE Dynamic Fixed Income ETF,US Fixed Income
AVSD,Avantis Responsible International Equity ETF,US Equity - Large Cap Blend
BRRR,Coinshares Bitcoin ETF,Currency
AVSU,Avantis Responsible U.S. Equity ETF,US Equity - Large Cap Blend
BIBL, Inspire 100 ETF,US Equity - Large Cap Blend
EEMS,iShares MSCI Emerging Markets Small-Cap ETF,US Equity - Large Cap Blend
DFEB,FT Vest U.S. Equity Deep Buffer ETF - February,US Equity - Large Cap Blend
KCE,State Street SPDR S&P Capital Markets ETF,US Equity - Large Cap Blend
XMVM,Invesco S&P MidCap Value with Momentum ETF,US Equity - Large Cap Blend
MFDX,PIMCO RAFI Dynamic Multi-Factor International Equity ETF,US Equity - Large Cap Blend
DJD,Invesco Dow Jones Industrial Average Dividend ETF,US Equity - Large Cap Blend
QMOM,Alpha Architect U.S. Quantitative Momentum ETF,US Equity - Large Cap Blend
DDLS,WisdomTree Dynamic International SmallCap Equity Fund,US Equity - Large Cap Blend
GGUS,Marketbeta Russell 1000 Growth Equity ETF,US Equity - Large Cap Blend
VIDI,Vident International Equity Strategy ETF,US Equity - Large Cap Blend
DRIV,Global X Autonomous & Electric Vehicles ETF,US Equity - Large Cap Blend
LRGE,ClearBridge Large Cap Growth Select ETF,US Equity - Large Cap Blend
IBHH,iShares iBonds 2028 Term High Yield and Income ETF,US Fixed Income
JPUS,JPMorgan Diversified Return Use Equity,US Equity - Large Cap Blend
NBOS,Neuberger Option Strategy ETF,US Equity - Large Cap Blend
NUBD,Nuveen ESG U.S. Aggregate Bond ETF,US Fixed Income
DCRE,DoubleLine Commercial Real Estate Debt ETF,US Fixed Income
ICOP,iShares Copper and Metals Mining ETF,US Equity - Large Cap Blend
JIG,JPMorgan International Growth ETF,US Equity - Large Cap Blend
KIE,State Street SPDR S&P Insurance ETF,US Equity - Large Cap Blend
MDAA,Myriad Dynamic Asset Allocation ETF,Multi-Asset
JPME,JPMorgan Diversified Return U.S. Mid Cap Equity ETF,US Equity - Large Cap Blend
BIDD,iShares International Dividend Active ETF,US Equity - Large Cap Blend
EZBC,Franklin Bitcoin ETF,Currency
ZAP,Global X U.S. Electrification ETF,US Equity - Large Cap Blend
MMIN,NYLI MacKay Muni Insured ETF,US Fixed Income
IBHI,iShares iBonds 2029 Term High Yield and Income ETF,US Fixed Income
GVAL,Cambria Global Value ETF,US Equity - Large Cap Blend
GMOI,GMO International Value ETF,US Equity - Large Cap Blend
GMAY,FT Vest U.S. Equity Moderate Buffer ETF - May,US Equity - Large Cap Blend
CSMD,Congress SMid Growth ETF,US Equity - Large Cap Blend
UTWO,US Treasury 2 Year Note ETF,US Fixed Income
FXY,Invesco Currencyshares Japanese Yen Trust,Currency
NUMV,Nuveen ESG Mid-Cap Value ETF,US Equity - Large Cap Blend
IDGT,iShares U.S. Digital Infrastructure and Real Estate ETF,US Equity - Large Cap Blend
EELV,Invesco S&P Emerging Markets Low Volatility ETF,US Equity - Large Cap Blend
GDEC,FT Vest U.S. Equity Moderate Buffer ETF - December,US Equity - Large Cap Blend
PRN,Invesco Dorsey Wright Industrials Momentum ETF,US Equity - Large Cap Blend
IBHG,iShares iBonds 2027 Term High Yield and Income ETF,US Fixed Income
BCD,abrdn Bloomberg All Commodity Longer Dated Strategy K-1 Free ETF,Commodity
SOFR,Amplify Samsung SOFR ETF,US Fixed Income
ONEV,State Street SPDR Russell 1000 Low Volatility Focus ETF,US Equity - Large Cap Blend
NFLT,Virtus Newfleet Multi-Sector Bond ETF,US Fixed Income
BBLU,EA Bridgeway Blue Chip ETF,US Equity - Large Cap Blend
VFMV,Vanguard U.S. Minimum Volatility ETF,US Equity - Large Cap Blend
DEHP,Dimensional Emerging Markets High Profitability ETF,US Equity - Large Cap Blend
JNUG,Direxion Daily Junior Gold Miners Index Bull 2X ETF,US Equity - Large Cap Blend
NBCM,Neuberger Commodity Strategy ETF,Commodity
PFLD,AAM Low Duration Preferred and Income Securities ETF,Multi-Asset
SIZE,iShares MSCI USA Size Factor ETF,US Equity - Large Cap Blend
PKB,Invesco Building & Construction ETF,US Equity - Large Cap Blend
CEMB,iShares J.P. Morgan EM Corporate Bond ETF,US Fixed Income
DDEC,FT Vest US Equity Deep Buffer ETF - December,US Equity - Large Cap Blend
UCO,ProShares Ultra Bloomberg Crude Oil,Commodity
SHYD,VanEck Short High Yield Muni ETF,US Fixed Income
GNMA,iShares GNMA Bond ETF,US Fixed Income
XFIV,BondBloxx Bloomberg Five Year Target Duration US Treasury ETF,US Fixed Income
HYBB,iShares BB Rated Corporate Bond ETF,US Fixed Income
KBWD,Invesco KBW High Dividend Yield Financial ETF,US Equity - Large Cap Blend
ASTX,Tradr 2X Long ASTS Daily ETF,US Equity - Large Cap Blend
FXZ,First Trust Materials AlphaDEX Fund,US Equity - Large Cap Blend
CONY,YieldMax COIN Option Income Strategy ETF,US Equity - Large Cap Blend
AIPI,REX AI Equity Premium Income ETF,US Equity - Large Cap Blend
MVLL,GraniteShares 2x Long MRVL Daily ETF,US Equity - Large Cap Blend
QVMM,Invesco S&P MidCap 400 QVM Multi-factor ETF,US Equity - Large Cap Blend
IQQQ,ProShares Nasdaq-100 High Income ETF,US Equity - Large Cap Blend
DMAR,FT Vest US Equity Deep Buffer ETF - March,US Equity - Large Cap Blend
SFTX,Horizon International Managed Risk ETF,Multi-Asset
DXUV,Dimensional US Vector Equity ETF,US Equity - Large Cap Blend
MDIV,Multi-Asset Diversified Income Index Fund,Multi-Asset
CEFS,Saba Closed End Funds ETF,Multi-Asset
ALAI,Alger AI Enablers & Adopters ETF,US Equity - Large Cap Blend
BUFM,AB Moderate Buffer ETF,US Equity - Large Cap Blend
DIAL,Columbia Diversified Fixed Income Allocation ETF,US Fixed Income
CDX,Simplify High Yield ETF,US Fixed Income
XSW,State Street SPDR S&P Software & Services ETF,US Equity - Large Cap Blend
DWAS,Invesco Dorsey Wright SmallCap Momentum ETF,US Equity - Large Cap Blend
TEQI,T. Rowe Price Equity Income ETF,US Equity - Large Cap Blend
GVUS,Marketbeta Russell 1000 Value Equity ETF,US Equity - Large Cap Blend
FXE,Invesco CurrencyShares Euro Trust,Currency
FDG,American Century Focused Dynamic Growth ETF,US Equity - Large Cap Blend
CFO,VictoryShares US 500 Enhanced Volatility Wtd ETF,US Equity - Large Cap Blend
SRVR,Pacer Data & Infrastructure Real Estate ETF,Real Estate
IRE,Defiance Daily Target 2X Long IREN ETF,US Equity - Large Cap Blend
TBFG,Brinsmere Fund Growth ETF,Multi-Asset
CSRE,Cohen & Steers Real Estate Active ETF,US Equity - Large Cap Blend
AIVL,WisdomTree U.S. AI Enhanced Value Fund,US Equity - Large Cap Blend
DJUL,FT Vest U.S. Equity Deep Buffer ETF - July,US Equity - Large Cap Blend
GQRE,FlexShares Global Quality Real Estate Index Fund,Real Estate
URNJ,Sprott Junior Uranium Miners ETF,US Equity - Large Cap Blend
FLTB,Fidelity Limited Term Bond ETF,US Fixed Income
HEDG,Equable Shares Hedged Equity ETF,US Equity - Large Cap Blend
YMAX,YieldMax Universe Fund of Option Income ETFs,US Equity - Large Cap Blend
BAPR,Innovator U.S. Equity Buffer ETF - April,US Equity - Large Cap Blend
GMF,State Street SPDR S&P Emerging Asia Pacific ETF,US Equity - Large Cap Blend
MUNY,Vanguard New York Tax-Exempt Bond ETF,US Fixed Income
FLUD,Franklin Ultra Short Bond ETF,US Fixed Income
AVMC,Avantis U.S. Mid Cap Equity ETF,US Equity - Large Cap Blend
WGMI,CoinShares Bitcoin Mining ETF,US Equity - Large Cap Blend
CCNR,ALPS | CoreCommodity Natural Resources ETF,US Equity - Large Cap Blend
GMAR,FT Vest U.S. Equity Moderate Buffer ETF - March,US Equity - Large Cap Blend
CVIE,Calvert International Responsible Index ETF,US Equity - Large Cap Blend
DFJ,WisdomTree Japan SmallCap Dividend Fund,US Equity - Large Cap Blend
BYLD,iShares Yield Optimized Bond ETF,US Fixed Income
SFTY,Horizon Managed Risk ETF,US Equity - Large Cap Blend
DNOV,FT Vest U.S. Equity Deep Buffer ETF - November,US Equity - Large Cap Blend
DBB,Invesco DB Base Metals Fund,Commodity
PTMC,Pacer Trendpilot US Mid Cap ETF,Multi-Asset
XJH,iShares ESG Select Screened S&P Mid-Cap ETF,US Equity - Large Cap Blend
CDL,VictoryShares US Large Cap High Dividend Volatility Wtd ETF,US Equity - Large Cap Blend
PAPI,Parametric Equity Premium Income ETF,US Equity - Large Cap Blend
MORT,VanEck Mortgage REIT Income ETF,Real Estate
AVXC,Avantis Emerging Markets ex-China Equity ETF,US Equity - Large Cap Blend
THNQ,ROBO Global Artificial Intelligence ETF,US Equity - Large Cap Blend
DOCT,FT Vest U.S. Equity Deep Buffer ETF - October,US Equity - Large Cap Blend
JPEM,JPMorgan Diversified Return Emerging Markets Equity ETF,US Equity - Large Cap Blend
PTIR,GraniteShares 2x Long PLTR Daily ETF,US Equity - Large Cap Blend
KHPI,Kensington Hedged Premium Income ETF,US Equity - Large Cap Blend
GJUL,FT Vest U.S. Equity Moderate Buffer ETF - July,US Equity - Large Cap Blend
USCI,United States Commodity Index Fund,Commodity
AGOX,Adaptive Alpha Opportunities ETF,Multi-Asset
DFEN,Direxion Daily Aerospace & Defense Bull 3X ETF,US Equity - Large Cap Blend
USDU,WisdomTree Bloomberg U.S. Dollar Bullish Fund,Currency
GFEB,FT Vest US Equity Moderate Buffer ETF February,US Equity - Large Cap Blend
SPXS,Direxion Daily S&P 500 Bear 3X ETF,US Equity - Large Cap Blend
BINT,Bluemonte Global Equity ETF,US Equity - Large Cap Blend
CAML,Congress Large Cap Growth ETF,US Equity - Large Cap Blend
SLVO,"UBS AG ETRACS Silver Shares Covered Call ETNs due April 21, 2033 ETP 2022-21.04.33 on CS NQ Slv FLS106 Pr",Multi-Asset
NUEM,Nuveen ESG Emerging Markets Equity ETF,US Equity - Large Cap Blend
TBFC,Brinsmere Fund Conservative ETF,Multi-Asset
QQQH,NEOS Nasdaq 100 Hedged Equity Income ETF,US Equity - Large Cap Blend
DGRS,WisdomTree US Smallcap Quality Dividend Growth Fund,US Equity - Large Cap Blend
IAK,iShares U.S. Insurance ETF,US Equity - Large Cap Blend
BJAN,Innovator U.S. Equity Buffer ETF - January,US Equity - Large Cap Blend
PDN,Invesco RAFI Developed Markets ex-U.S. Small-Mid ETF,US Equity - Large Cap Blend
EWM,iShares MSCI Malaysia ETF,US Equity - Large Cap Blend
POWR,iShares U.S. Power Infrastructure ETF,US Equity - Large Cap Blend
DUBS,Aptus Large Cap Enhanced Yield ETF,US Equity - Large Cap Blend
NJAN,Innovator Growth-100 Power Buffer ETF - January,US Equity - Large Cap Blend
EWQ,iShares MSCI France ETF,US Equity - Large Cap Blend
BKCH,Global X Blockchain ETF,US Equity - Large Cap Blend
BASV,Brown Advisory Sustainable Value ETF,US Equity - Large Cap Blend
GJUN,FT Vest U.S. Equity Moderate Buffer ETF - June,US Equity - Large Cap Blend
AAUA,Alpha Architect US Equity 3 ETF,US Equity - Large Cap Blend
UUP,Invesco DB US Dollar Index Bullish Fund,Currency
NUMG,Nuveen ESG Mid-Cap Growth ETF,US Equity - Large Cap Blend
ORCX,Defiance Daily Target 2X Long ORCL ETF,US Equity - Large Cap Blend
SIXZ,AllianzIM U.S. Equity 6 Month Buffer10 May/Nov ETF,US Equity - Large Cap Blend
HCRB,Hartford Core Bond ETF,US Fixed Income
